{
  "candidate": "clean-room-contract-skills-001",
  "track": "contract-plus-skills",
  "generatedBy": "GPT-5 Codex",
  "cleanRoom": true,
  "allowedInputs": [
    "benchmarks/component-fidelity/metric-card/clean-room/prompt.md",
    "benchmarks/component-fidelity/metric-card/clean-room/allowed-inputs.json",
    "benchmarks/component-fidelity/metric-card/clean-room/candidate.schema.json",
    "README.md",
    "AGENTS.md",
    "DESIGN.md",
    ".design/AGENT.md",
    ".design/INDEX.md",
    ".design/components/ACTIONS.md",
    ".design/components/COMMANDS-SEARCH.md",
    ".design/components/DATA-DISPLAY.md",
    ".design/components/FEEDBACK-OVERLAYS.md",
    ".design/patterns/PAGES.md",
    ".design/patterns/SHELLS.md",
    ".design/verticals/web/BASE.md",
    ".design/verticals/web/APP.md",
    "templates/design/PROJECT.md",
    "templates/design/COMPONENTS.md",
    "templates/design/REFERENCES.md",
    "templates/design/COMPOSITION.json",
    "skills/design-system/SKILL.md",
    "skills/design-review/SKILL.md"
  ],
  "provenance": {
    "runId": "clean-room-contract-skills-001-2026-07-22T20-33-00-04-00",
    "model": "GPT-5 Codex",
    "operator": "Codex",
    "generatedAt": "2026-07-22T20:33:00-04:00",
    "targetAccess": false,
    "promptSha256": "743A49593C40F34C26842FEED0D9257A280B94E6CD820BE338FC26BBA1515B56",
    "allowedInputsSha256": "1D803F6B073CB788CECE44488ACA25196B8BB19729E5482F5F35B11BF4271E93",
    "allowedInputFiles": [
      "benchmarks/component-fidelity/metric-card/clean-room/prompt.md",
      "benchmarks/component-fidelity/metric-card/clean-room/allowed-inputs.json",
      "benchmarks/component-fidelity/metric-card/clean-room/candidate.schema.json",
      "README.md",
      "AGENTS.md",
      "DESIGN.md",
      ".design/AGENT.md",
      ".design/INDEX.md",
      ".design/components/ACTIONS.md",
      ".design/components/COMMANDS-SEARCH.md",
      ".design/components/DATA-DISPLAY.md",
      ".design/components/FEEDBACK-OVERLAYS.md",
      ".design/patterns/PAGES.md",
      ".design/patterns/SHELLS.md",
      ".design/verticals/web/BASE.md",
      ".design/verticals/web/APP.md",
      "templates/design/PROJECT.md",
      "templates/design/COMPONENTS.md",
      "templates/design/REFERENCES.md",
      "templates/design/COMPOSITION.json",
      "skills/design-system/SKILL.md",
      "skills/design-review/SKILL.md"
    ],
    "cleanRoomAttestation": "I did not read the hidden target, prior candidates, scorer output, benchmark misses, or any files outside the contract-plus-skills allowed inputs."
  },
  "anatomy": [
    "metric.root",
    "metric.header",
    "metric.label",
    "metric.menu-trigger",
    "metric.value",
    "metric.delta",
    "metric.caption",
    "metric.sparkline",
    "metric.status-dot",
    "metric.focus-ring"
  ],
  "tokens": {
    "width": 264,
    "padding": 14,
    "gap": 10,
    "radius": 8,
    "background": "#171717",
    "foreground": "#f7f7f4",
    "border": "#2e2e2b",
    "mutedForeground": "#a7a29b",
    "accent": "#9eb7ff",
    "positive": "#7ddf9a",
    "warning": "#f5c56b",
    "shadow": "0 8px 18px rgba(0, 0, 0, 0.22)",
    "fontFamily": "Inter",
    "labelWeight": 650,
    "valueWeight": 720,
    "labelSize": 12,
    "valueSize": 32,
    "deltaSize": 12,
    "captionSize": 11,
    "sparklineHeight": 42
  },
  "states": {
    "hover": {
      "background": "#20201d",
      "border": "#3a3a36",
      "shadow": "0 12px 30px rgba(0, 0, 0, 0.28)"
    },
    "focusVisible": {
      "outlineWidth": 2,
      "outlineColor": "#9eb7ff",
      "outlineOffset": 2
    },
    "selected": {
      "border": "#9eb7ff",
      "background": "#232b3d"
    },
    "stale": {
      "statusColor": "#f5c56b",
      "caption": "Data stale: last updated 18m ago",
      "opacity": 0.72
    }
  },
  "content": {
    "label": "Active incidents",
    "value": "1,284",
    "delta": "+12.4%",
    "caption": "vs last 7 days",
    "menuLabel": "Metric actions",
    "staleCaption": "Data stale: last updated 18m ago"
  }
}
